{"schema_version":1,"goal":"Aprender sobre astronomía y redactar un resumen","privacy_scope":"public","steps":[{"step_id":"find","operation":"search","arguments":{"query":"astronomía básica"}},{"step_id":"summary","operation":"compose","depends_on":["find"],"arguments":{"output_format":"telegram"}}],"missing_fields":[],"confidence":0.95,"budget":{"calls":2,"message_limit":0,"max_usd":"0.10"}}
