{"schema_version":1,"goal":"Preparar un contacto ya seleccionado","privacy_scope":"personal","steps":[{"step_id":"draft","operation":"compose","arguments":{"private_ref":{"blob_key":"fixture/context.age","sha256":"aaaaaaaaaaaaaaaaaaaaaaaaaaaaaaaaaaaaaaaaaaaaaaaaaaaaaaaaaaaaaaaa","recipient_scope":"worker:task-router"}}},{"step_id":"contact","operation":"contact","depends_on":["draft"],"arguments":{"recipient_refs":["contact:fixture_person"],"purpose":"solicitud_sintetica","private_ref":{"blob_key":"fixture/message.age","sha256":"bbbbbbbbbbbbbbbbbbbbbbbbbbbbbbbbbbbbbbbbbbbbbbbbbbbbbbbbbbbbbbbb","recipient_scope":"worker:task-router"},"session_ref":"fixture:local","session_version":1}}],"missing_fields":[],"confidence":1}
